Semester,Course Code,Course Title,Course Type,Internal Marks,External Marks,Total,Max. Marks,Result
4,SAIC4003,Universal Human Values,Theory,44,29,73,100,Pass
4,SCSA1401,Object Oriented Analysis and System Engineering,Theory,29,24,53,100,Pass
4,SCSA1403,Design and Analysis of Algorithms,Theory,38,27,65,100,Pass
4,SECA1404,Microprocessor and Microcontroller Based Systems,Theory,36,41,77,100,Pass
4,SITA3004,User Interface Design and Implementation,Theory,36,26,62,100,Pass
4,SMTA1402,Probability and Statistics,Theory,36,18,54,100,Pass
4,SCSA2401,Object Oriented Analysis and System Engineering Lab,Practical,48,46,94,100,Pass
4,SCSA2402,Code Optimization and Debugging - II,Practical,21,22,43,50,Pass
4,SECA2405,Microprocessor and Microcontroller Lab,Practical,46,35,81,100,Pass
